{
  "$schema": "https://json-schema.org/draft/2020-12/schema",
  "$id": "https://pcs.sentinelops.ci/schemas/CoverageReport.v0.schema.json",
  "title": "CoverageReport.v0",
  "type": "object",
  "required": [
    "schema_version",
    "coverage_id",
    "metric",
    "numerator",
    "denominator",
    "coverage_ratio",
    "details",
    "source_repo",
    "source_commit",
    "signature_or_digest"
  ],
  "additionalProperties": false,
  "properties": {
    "schema_version": { "$ref": "common.defs.json#/$defs/schema_version" },
    "coverage_id": { "type": "string", "minLength": 1 },
    "metric": {
      "oneOf": [
        { "$ref": "common.defs.json#/$defs/benchmark_metric_name" },
        { "$ref": "common.defs.json#/$defs/benchmark_metric_id" }
      ]
    },
    "metric_id": { "$ref": "common.defs.json#/$defs/benchmark_metric_id" },
    "numerator": { "type": "number", "minimum": 0 },
    "denominator": { "type": "number", "minimum": 0 },
    "coverage_ratio": { "type": "number", "minimum": 0, "maximum": 1 },
    "details": {
      "type": "object",
      "additionalProperties": true
    },
    "source_repo": { "type": "string", "format": "uri" },
    "source_commit": { "$ref": "common.defs.json#/$defs/git_commit" },
    "signature_or_digest": { "$ref": "common.defs.json#/$defs/hex_digest" }
  }
}
