{
  "schema_version": "v0",
  "coverage_id": "labtrust-qc-release-v0-registry",
  "metric": "registry_coverage",
  "numerator": 0.0,
  "denominator": 1.0,
  "coverage_ratio": 0.0,
  "details": {
    "registry_entry_count": 49
  },
  "source_repo": "https://github.com/SentinelOps-CI/pcs-core",
  "source_commit": "d444444444444444444444444444444444444444",
  "signature_or_digest": "sha256:f8df360f4c35f4efc0d20f5ea82138a6303239388751b35aa94beccead907cca"
}
