{
  "schema_version": "v0",
  "coverage_id": "certifyedge-cert-bench-v0",
  "metric": "certificate_completeness",
  "metric_id": "certificate_completeness_score",
  "numerator": 4.0,
  "denominator": 4.0,
  "coverage_ratio": 1.0,
  "details": {
    "producer_id": "certifyedge",
    "certificate_id": "cert-labtrust-qc-v0",
    "violations": []
  },
  "source_repo": "https://github.com/fraware/CertifyEdge",
  "source_commit": "17e414501b3e1c58e8fbde1fe89a828440a945d9",
  "signature_or_digest": "sha256:41a447e3d126819a85e77dc2ddbc3e67a2d9dfe4c1e86cf0481022ef6e7c06e5"
}
